Synonyms,Glossary,Synset in hierarchy,,,,,,,,,Label,PossibleNone,Familiar,UnfamiliarANDunsure,Notes,Synset
seat,furniture that is designed for sitting on,,"[Synset('seat.n.03'),",,,,,,,,b,,y,x,could be basic level or superordinate as can be anything you can sit upon or subordinate as specific type of furniture for seating ,Synset('seat.n.03')
chest_of_drawers chest bureau dresser,furniture with drawers for keeping clothes,,"[Synset('chest_of_drawers.n.01'),",,,,,,,,b,,y,,chest would be basic level?,Synset('chest_of_drawers.n.01')
pool_table billiard_table snooker_table,game equipment consisting of a heavy table on which pool is played,,,"[Synset('pool_table.n.01')],",,,,,,,b,,y,,specific type of table,Synset('pool_table.n.01')
pew church_bench,long bench with backs; used in church by the congregation,,,,"[Synset('pew.n.01')],",,,,,,l,,y,,,Synset('pew.n.01')
prie-dieu,low bench for kneeling on,,,,"[Synset('prie-dieu.n.01')],",,,,,,l,,y,,,Synset('prie-dieu.n.01')
coffee_table cocktail_table,low table where magazines can be placed and coffee or cocktails are served,,,"[Synset('coffee_table.n.01')],",,,,,,,l,,y,,specific type of table,Synset('coffee_table.n.01')
dressing_table dresser vanity toilet_table,low table with mirror or mirrors where one sits while dressing or applying makeup,,,"[Synset('dressing_table.n.01')],",,,,,,,l,,y,,specific type of table,Synset('dressing_table.n.01')
milking_stool,low three-legged stool with a half round seat; used to sit on while milking a cow,,,,"[Synset('milking_stool.n.01')],",,,,,,l,,y,,,Synset('milking_stool.n.01')
file file_cabinet filing_cabinet,office furniture consisting of a container for keeping papers in order,,,"[Synset('file.n.03'),",,,,,,,l,,y,,type of cabinet in office - cabinet BL?,Synset('file.n.03')
twin_bed,one of a pair of identical beds,,,,"[Synset('twin_bed.n.01')],",,,,,,l,,y,,,Synset('twin_bed.n.01')
platform_rocker,rocking chair on a stationary base,,,,,"[Synset('platform_rocker.n.01')],",,,,,l,,y,,specific type of chair ,Synset('platform_rocker.n.01')
minibar cellaret,sideboard with compartments for holding bottles,,,"[Synset('minibar.n.01')]],",,,,,,,l,,y,,specific type of bar,Synset('minibar.n.01')
love_seat loveseat tete-a-tete vis-a-vis,small sofa that seats two people,,,,"[Synset('love_seat.n.01')],",,,,,,l,,y,,,Synset('love_seat.n.01')
milk_bar,snack bar that sells milk drinks and light refreshments (such as ice cream),,,,,,"[Synset('milk_bar.n.01')]],",,,,l,,y,,specific,Synset('milk_bar.n.01')
Windsor_chair,straight chair having a shaped seat and a back of many spindles,,,,,"[Synset('windsor_chair.n.01')]],",,,,,l,,y,,specific type of chair ,Synset('windsor_chair.n.01')
counter,table consisting of a horizontal surface over which business is transacted,,,"[Synset('counter.n.01'),",,,,,,,l,,y,,specific type of table,Synset('counter.n.01')
operating_table,table on which the patient lies during a surgical operation,,,"[Synset('operating_table.n.01')],",,,,,,,l,,y,,specific type of table,Synset('operating_table.n.01')
deathbed,the bed on which a person dies,,,,"[Synset('deathbed.n.02')],",,,,,,l,,y,,,Synset('deathbed.n.02')
sickbed,the bed on which a sick person lies,,,,"[Synset('sickbed.n.01')],",,,,,,l,x,y,,more figure of speech ,Synset('sickbed.n.01')
marriage_bed,the bed shared by a newly wed couple,,,,"[Synset('marriage_bed.n.01')],",,,,,,l,x,y,,more figure of speech ,Synset('marriage_bed.n.01')
throne,"the chair of state for a monarch, bishop, etc.",,,,,"[Synset('throne.n.01'),",,,,,b,,y,,very specific/not commonly used but is distinct to know purpose/setting,Synset('throne.n.01')
dinner_table,the dining table where dinner is served and eaten,,,,"[Synset('dinner_table.n.01')],",,,,,,l,,y,,specific type of table,Synset('dinner_table.n.01')
box box_seat,the driver's seat on a coach,,,"[Synset('box.n.08')],",,,,,,,l,,y,,,Synset('box.n.08')
bedstead bedframe,the framework of a bed,,"[Synset('bedstead.n.01')],",,,,,,,,l,,y,,subordinate to bed,Synset('bedstead.n.01')
peacock-throne,the golden throne of former kings of Delhi; stolen by the Persians in 1739 and subsequently lost; symbol of the former Shah of Iran,,,,,,"[Synset('peacock-throne.n.01')]]],",,,,l,,n,,specific/not commonly used by people ,Synset('peacock-throne.n.01')
upper_berth upper,the higher of two berths,,,,,"[Synset('upper_berth.n.01')]],",,,,,l,,y,,,Synset('upper_berth.n.01')
toilet_seat,the hinged seat on a toilet,,,"[Synset('toilet_seat.n.01')]],",,,,,,,b,,y,,,Synset('toilet_seat.n.01')
lower_berth lower,the lower of two berths,,,,,"[Synset('lower_berth.n.01')],",,,,,l,,y,,,Synset('lower_berth.n.01')
altar communion_table Lord's_table,the table in Christian churches where communion is given,,,"[Synset('altar.n.01')],",,,,,,,b,,y,,differentiate it from others,Synset('altar.n.01')
conference_table council_table council_board,the table that conferees sit around as they hold a meeting,,,"[Synset('conference_table.n.01')],",,,,,,,l,,y,,specific type of table,Synset('conference_table.n.01')
mercy_seat,the throne of God,,,,,,"[Synset('mercy_seat.n.01')],",,,,l,,n,,specific contextual term ,Synset('mercy_seat.n.01')
ottoman pouf pouffe puff hassock,thick cushion used as a seat,,,"[Synset('ottoman.n.03')],",,,,,,,l,,y,,,Synset('ottoman.n.03')
snack_bar snack_counter buffet,usually inexpensive bar,,,,,"[Synset('snack_bar.n.01'),",,,,,l,,y,,specific contextual term ,Synset('snack_bar.n.01')
platen,work table of a machine tool,,,"[Synset('platen.n.01')],",,,,,,,l,,n,,specific type of table,Synset('platen.n.01')