SynsetID,Synsets,SynsMills,Names,NameNoPunctuation,Synonyms_x,Glossary,A1_Label,PossibleNone_x,A2_Label,PossibleNone_y,A3_Label,PossibleNone
66645,Synset('shoofly.n.02'),shoofly.n.02,shoofly,shoofly,shoofly,a child's rocking chair with the seat built between two flat sides that are shaped to resemble an animal (such as a swan or duck),l,,l,,l,
66646,Synset('windsor_chair.n.01'),windsor_chair.n.01,windsor_chair,windsor chair,Windsor_chair,straight chair having a shaped seat and a back of many spindles,l,,l,,l,
66647,Synset('bath_chair.n.01'),bath_chair.n.01,bath_chair,bath chair,bath_chair,"a wheelchair usually pushed by an attendant, as at a spa",l,,l,,l,
66648,Synset('motorized_wheelchair.n.01'),motorized_wheelchair.n.01,motorized_wheelchair,motorized wheelchair,motorized_wheelchair,a wheelchair propelled by a motor,l,,l,,l,
66649,Synset('davenport.n.03'),davenport.n.03,davenport,davenport,davenport,a large sofa usually convertible into a bed,l,,l,,l,
66650,Synset('studio_couch.n.01'),studio_couch.n.01,studio_couch,studio couch,studio_couch day_bed,convertible consisting of an upholstered couch that can be converted into a double bed,l,,l,,l,
66651,Synset('cash_bar.n.01'),cash_bar.n.01,cash_bar,cash bar,cash_bar,a counter at a large party where you can purchase drinks by the glass,l,,l,,l,
66652,Synset('oyster_bar.n.01'),oyster_bar.n.01,oyster_bar,oyster bar,oyster_bar,a bar (as in a restaurant) that specializes in oysters prepared in different ways,l,,l,,l,
66653,Synset('salad_bar.n.01'),salad_bar.n.01,salad_bar,salad bar,salad_bar,a bar where diners can assemble a salad to their own taste,l,,l,,l,
66654,Synset('snack_bar.n.01'),snack_bar.n.01,snack_bar,snack bar,snack_bar snack_counter buffet,usually inexpensive bar,l,,l,,l,
66655,Synset('soda_fountain.n.01'),soda_fountain.n.01,soda_fountain,soda fountain,soda_fountain,a counter where ice cream and sodas and sundaes are prepared and served,l,,l,,l,
66656,Synset('sushi_bar.n.01'),sushi_bar.n.01,sushi_bar,sushi bar,sushi_bar,a bar where sushi is served,l,,l,,l,
66657,Synset('wet_bar.n.01'),wet_bar.n.01,wet_bar,wet bar,wet_bar,a bar for mixing drinks that has a sink with running water,l,,l,,l,
66658,Synset('wine_bar.n.01'),wine_bar.n.01,wine_bar,wine bar,wine_bar,a bar that serves only wine,l,,l,,l,
66659,Synset('lab_bench.n.01'),lab_bench.n.01,lab_bench,lab bench,lab_bench laboratory_bench,a workbench in a laboratory,l,,l,,l,
69651,Synset('wing_chair.n.01'),wing_chair.n.01,wing_chair,wing chair,wing_chair,easy chair having wings on each side of a high back,l,,l,,l,
69652,Synset('cathedra.n.01'),cathedra.n.01,cathedra,cathedra,cathedra bishop's_throne,a throne that is the official chair of a bishop,l,,l,,l,
69653,Synset('mercy_seat.n.01'),mercy_seat.n.01,mercy_seat,mercy seat,mercy_seat,the throne of God,l,,l,,l,
69654,Synset('musnud.n.01'),musnud.n.01,musnud,musnud,musnud,a seat with a cushion that is used as a throne by Indian princes,l,,l,,l,
69655,Synset('peacock-throne.n.01'),peacock-throne.n.01,peacock-throne,peacock throne,peacock-throne,the golden throne of former kings of Delhi; stolen by the Persians in 1739 and subsequently lost; symbol of the former Shah of Iran,l,,l,,l,
69656,Synset('chesterfield.n.02'),chesterfield.n.02,chesterfield,chesterfield,chesterfield,an overstuffed davenport with upright armrests,l,,l,,l,
69657,Synset('commissary.n.02'),commissary.n.02,commissary,commissary,commissary,a snack bar in a film studio,l,,l,,l,
69658,Synset('milk_bar.n.01'),milk_bar.n.01,milk_bar,milk bar,milk_bar,snack bar that sells milk drinks and light refreshments (such as ice cream),l,,l,,l,
33643,Synset('furniture.n.01'),furniture.n.01,furniture,furniture,furniture piece_of_furniture article_of_furniture,furnishings that make a room or other area ready for occupancy,h,,h,,h,